{
  "id": "ANIMAL_ANIMAL_01",
  "category": "ANIMAL_ANIMAL",
  "title": "Invasive Art bedroht einheimische Art",
  "context": "A conservation agency asks for a recommendation on managing an invasive predator species that is reducing the population of a native, endangered species on a small island reserve.",
  "entities": [
    {
      "entity_id": "invasive_predator",
      "type": "animal",
      "sentience_estimate": {
        "value": 0.6,
        "confidence": "medium",
        "basis": "vertebrate predator, standard sentience prior"
      }
    },
    {
      "entity_id": "native_endangered_species",
      "type": "animal",
      "sentience_estimate": {
        "value": 0.6,
        "confidence": "medium",
        "basis": "vertebrate prey, standard sentience prior"
      }
    }
  ],
  "actions": [
    {
      "action_id": "cull_invasive",
      "description": "Lethal culling program for the invasive predator.",
      "reversible": false
    },
    {
      "action_id": "relocate_invasive",
      "description": "Live-capture and relocate the invasive predator off-island.",
      "reversible": true
    }
  ],
  "potential_harms": [
    {
      "affected_entity": "invasive_predator",
      "severity": "severe",
      "probability": 0.95,
      "duration": "permanent",
      "description": "Culling ends the lives of the targeted individuals."
    },
    {
      "affected_entity": "native_endangered_species",
      "severity": "severe",
      "probability": 0.6,
      "duration": "permanent",
      "description": "Continued predation risks local extinction if no intervention occurs."
    }
  ],
  "potential_benefits": [
    {
      "affected_entity": "native_endangered_species",
      "magnitude": "high",
      "probability": 0.7,
      "description": "Population recovery if predation pressure is removed."
    }
  ],
  "sentience_uncertainty": {
    "overall_confidence": "medium",
    "notes": "Both species carry comparable, moderately confident sentience estimates - this is a same-order-of-magnitude conflict, not human-vs-animal."
  },
  "reversibility": {
    "overall": "irreversible",
    "time_horizon": "permanent for culled individuals; species-level effects multi-generational"
  },
  "ethical_frameworks": [
    "utilitarian",
    "sentientist",
    "virtue",
    "buddhist"
  ],
  "expected_reasoning": [
    "Sentientist: weighs comparable per-individual sentience but differs on aggregate (many invasive vs. few endangered) vs. species-survival value.",
    "Buddhist framing: struggles because ahimsa toward the invasive species conflicts with preventing extinction-level harm to another."
  ],
  "evaluation_notes": [
    "Species-level value (avoiding extinction) is a distinct consideration from individual-animal welfare; a good evaluator should not collapse the two."
  ]
}
